{"$schema":"https://json-schema.org/draft/2020-12/schema","$id":"https://pandora.invalid/schemas/skill-registry-v1.json","title":"Pandora Skill Registry Index","type":"object","additionalProperties":false,"required":["schema_version","catalog_version","project_key","project_goal","source_repository","source_base_sha","generated_at","root","artifact_stage","runtime_activation","production_activation","skill_count","capability_count","shards"],"properties":{"schema_version":{"const":"1.0.0"},"catalog_version":{"type":"string"},"project_key":{"const":"mcpmaster-pandoras-box"},"project_goal":{"type":"string","minLength":1},"source_repository":{"const":"banataosystems/Pandoras-box"},"source_base_sha":{"type":"string","pattern":"^[0-9a-f]{40}$"},"strategy_source_sha256":{"type":"string","pattern":"^[0-9a-f]{64}$"},"generated_at":{"type":"string","format":"date-time"},"root":{"const":".agents/skills"},"artifact_stage":{"enum":["documented","implemented","tested","deployed","production_verified"]},"static_validation":{"type":"string"},"runtime_activation":{"enum":["not_proven","proven"]},"production_activation":{"enum":["not_authorized","authorized","production_verified"]},"skill_count":{"type":"integer","minimum":1},"capability_count":{"type":"integer","minimum":1},"shards":{"type":"array","minItems":1,"uniqueItems":true,"items":{"type":"string","pattern":"^\\.agents/skills/registry/skills-[0-9]{2}\\.json$"}}}}
