{"schema_version":"1.0.0","catalog_version":"1.0.0","project_key":"mcpmaster-pandoras-box","project_goal":"Turn human intent into trusted, working digital systems.","source_repository":"banataosystems/Pandoras-box","source_base_sha":"c2cc635383b78d457d1731294a6f5b306d85f6be","strategy_source_sha256":"6118eb2872c9d2d3f4b9bcd1d1f36450e445a12a029b97ebcd251bd2540d0eed","generated_at":"2026-08-19T11:44:08Z","root":".agents/skills","artifact_stage":"implemented","static_validation":"required","runtime_activation":"not_proven","production_activation":"not_authorized","skill_count":51,"capability_count":57,"shards":[".agents/skills/registry/skills-01.json",".agents/skills/registry/skills-02.json",".agents/skills/registry/skills-03.json",".agents/skills/registry/skills-04.json",".agents/skills/registry/skills-05.json",".agents/skills/registry/skills-06.json"]}
